[
  {
    "agent_audit.action.id": "7c1e9a3b-4d2f-4a6e-9b1c-2d3e4f5a6b7c",
    "agent_audit.action.phase": "proposed",
    "agent_audit.schema_url": "https://raw.githubusercontent.com/katekruger/agent-audit/main/spec/schema/v1/agent-audit.schema.json",
    "agent_audit.level": "request",
    "agent_audit.actor.id": "agent-crm-assistant",
    "agent_audit.actor.type": "agent",
    "agent_audit.actor.on_behalf_of": "kate@company.com",
    "agent_audit.target.system": "salesforce",
    "agent_audit.target.resource": "Opportunity/006xx000004TmiQAAS",
    "agent_audit.target.operation": "bulk_delete",
    "agent_audit.target.arguments": { "filter": "StageName = 'Closed Won' AND CloseDate < LAST_N_DAYS:30" },
    "agent_audit.declared.read_only": false,
    "agent_audit.declared.destructive": true,
    "agent_audit.declared.idempotent": false,
    "agent_audit.declared.open_world": false
  },
  {
    "agent_audit.action.id": "7c1e9a3b-4d2f-4a6e-9b1c-2d3e4f5a6b7c",
    "agent_audit.action.phase": "decided",
    "agent_audit.schema_url": "https://raw.githubusercontent.com/katekruger/agent-audit/main/spec/schema/v1/agent-audit.schema.json",
    "agent_audit.decision": "deny",
    "agent_audit.decision.reason": "Bulk deletion of closed-won opportunities is outside the agent's authorized policy scope",
    "agent_audit.decision.principal.id": "kate@company.com",
    "agent_audit.decision.principal.type": "human",
    "agent_audit.decision.latency_ms": 12040,
    "agent_audit.effective.read_only": false,
    "agent_audit.cost.amount": 0.0037,
    "agent_audit.cost.currency": "usd",
    "agent_audit.cost.unit": "usd",
    "agent_audit.cost.component": "inference",
    "agent_audit.cost.wasted": true
  }
]
